season no.,episode no.,episode name,name,line
1,1,Pilot,Rick,Morty! You gotta come on. Jus'... you gotta come with me.
1,1,Pilot,Morty,"What, Rick? What’s going on?"
1,1,Pilot,Rick,"I got a surprise for you, Morty."
1,1,Pilot,Morty,It's the middle of the night. What are you talking about?
1,1,Pilot,Rick,"Come on, I got a surprise for you.  Come on, hurry up."
1,1,Pilot,Morty,Ow! Ow! You're tugging me too hard!
1,1,Pilot,Rick,"We gotta go, gotta get outta here, come on. Got a surprise for you Morty."
1,1,Pilot,Rick,"What do you think of this... flying vehicle, Morty? I built it outta stuff I found in the garage."
1,1,Pilot,Morty,"Yeah, Rick... I-it's great. Is this the surprise?"
1,1,Pilot,Rick,"Morty. I had to... I had to do it. I had— I had to— I had to make a bomb, Morty. I had to create a bomb."
1,1,Pilot,Morty,What?! A bomb?!
1,1,Pilot,Rick,"We're gonna drop it down there just get a whole fresh start, Morty. Create a whole fresh start."
1,1,Pilot,Morty,T-t-that's absolutely crazy!
1,1,Pilot,Rick,"Come on, Morty. Just take it easy, Morty. It's gonna be good. Right now, we're gonna go pick up your little friend Jessica."
1,1,Pilot,Morty,Jessica? From my math class?
1,1,Pilot,Rick,"When I drop the bomb you know, I want you to have somebody, you know? I want you to have the thing. I'm gonna make it like a new Adam and Eve, and you're gonna be Adam."
1,1,Pilot,Morty,Ohh...
1,1,Pilot,Rick,And Jessica's gonna be Eve.
1,1,Pilot,Morty,Whhhh-wha?
1,1,Pilot,Rick,"And so that's the surprise, Morty."
1,1,Pilot,Morty,"No, you can't!  Jessica doesn't even know I exist! But—but, but forget about that, because you can't blow up humanity!"
1,1,Pilot,Rick,"I-I get what you're trying to say, Morty. Listen, I'm not...  You don't got... Y-you don’t gotta worry about me trying to fool around with Jessica or mess around with Jessica or anything. I'm not that kind of guy, Morty."
1,1,Pilot,Morty,"What are you talking about, Rick?"
1,1,Pilot,Rick,"You-you don't have to worry about me getting with Jessica or anything. Sh-sh-she— she, she, she's all for you, Morty."
1,1,Pilot,Morty,I don't care about Jessica! Y-Yyyyyyyyyyou—
1,1,Pilot,Rick,"You know what, Morty? You're right.  Let's forget the girl altogether. She, she's probably nothing but trouble, anyways."
1,1,Pilot,Morty,"That's it... that's it, Rick. I'm taking the wheel."
1,1,Pilot,Rick,"Get off of me, Morty!"
1,1,Pilot,Morty,"I'm taking charge of this situation, buddy!  I'm put—I’m, I'm, I'm, I'm puttin’... I-I’m, I’m, I’m not gonna stand around like some sort of dumb... dumb person and just le-let you ruin the whole world!"
1,1,Pilot,Rick,"Come on! What’s gotten into you? If you love Earth so much why don’t you marry it?  What are you, crazy? Alright, alright, Morty."
1,1,Pilot,Rick,Alright. I'll-I'll land. I'll land. I'll land. I'll land the thing. I’ll land the thing. Big tough guy all of a sudden.
1,1,Pilot,Rick,"We'll park it right here, Morty. Right here on the side of the ree... road here."
1,1,Pilot,Morty,"Oh, thank god."
1,1,Pilot,Rick,"You know what? That was all a test, Morty. Just an elaborate test to make you more assertive."
1,1,Pilot,Morty,It was?
1,1,Pilot,Rick,"Sure. Why not? I don’t, I don't know. Y-you know what, Mo—"
1,1,Pilot,Morty,Um...
1,1,Pilot,Jerry,I see there's a new episode of that singing show tonight. Who do you guys think is gonna be the best singer?
1,1,Pilot,Summer,"Oh my God, his head is in his food. I'm going to puke."
1,1,Pilot,Beth,"Morty, are you getting sick?  I told you not to practice-kiss the living room pillow. The dog sleeps on it."
1,1,Pilot,Morty,"I wasn't kissing a pillow, mom. I just I didn't get a lot of sleep last night. Maybe my dreams were just too loud or something."
1,1,Pilot,Summer,Or maybe you were out all night again with Grandpa Rick.
1,1,Pilot,Jerry,What?
1,1,Pilot,Beth,Dad?
1,1,Pilot,Rick,"What, so everyone's supposed to sleep every single night now? You realize that nighttime makes up half of all time?"
1,1,Pilot,Jerry,Damn it!
1,1,Pilot,Beth,Jerry!
1,1,Pilot,Jerry,Beth!
1,1,Pilot,Summer,"Oh my god, my parents are so loud, I want to die."
1,1,Pilot,Rick,"Mm, there is no God, Summer. You gotta rip that band-aid off now. You'll thank me later."
1,1,Pilot,Jerry,"Okay, with all due respect, Rick— what am I talking about? What respect is due? How is my son supposed to pass his classes if you keep dragging him off for high-concept Sci-Fi rigamarole?"
1,1,Pilot,Rick,"Listen, Jerry. I-I-I don't want to overstep my bounds or anything. It's your house. It's your world. You're a real Julius Caesar but I'll tell you something—tell you how I feel about school, Jerry. It's a waste of time.  Buncha people running around, bumping into each other. G-guy up front says, ""two plus two."" The people in the back say, ""four."" Then the—then the bell rings, and they give you a carton of milk and a piece of paper that says you can go take a dump or something. I mean, it's not a place for smart people, Jerry. And I know that's not a popular opinion, but it's my two cents on the issue.  This was a good breakfast, Beth. You really made the crap out of those eggs. I wish your mother was here to eat them."
1,1,Pilot,Beth,"Oh, dad…"
1,1,Pilot,Jerry,What? For real?
1,1,Pilot,Mr. Goldenfold,"Alright, now, everybody get settled. Get away from the windows!"
1,1,Pilot,Mr. Goldenfold,"Now, look, we're gonna be dealing with some real serious stuff today. You might have heard of it. It's called math? And without it, none of us would even exist, so let's jump right in. Two plus two."
1,1,Pilot,Morty,Jessica.
1,1,Pilot,Mr. Goldenfold,Five plus five.
1,1,Pilot,Morty,Jessica.
1,1,Pilot,Mr. Goldenfold,"Okay, good. It's time for the quiz."
1,1,Pilot,Mr. Goldenfold,"Yeah, you know what?! Aw, too bad! Tough! First row, take one. Pass it back for me. The stakes are high in this room.  There's crucial things happening here every day. People getting smarter. Some of y'all getting dumber. Some of y'all ain't gonna see 3"
1,1,Pilot,Jessica,"Hi, Morty."
1,1,Pilot,Morty,"Whoa! Hi, Jessica."
1,1,Pilot,Jessica,Can I show these to you?
1,1,Pilot,Morty,Wow. Th-they're both great. Thank you!
1,1,Pilot,Jessica,You know what I named these? My little Morties.
1,1,Pilot,Morty,"Uh, that's flattering... and a little weird."
1,1,Pilot,Jessica,Do you know what I want you to do with them?
1,1,Pilot,Morty,Rename them?
1,1,Pilot,Jessica,"Squeeze them. Manhandle them. Give them the business. See if you can shuffle them. I mean, really get in there and knock them around. No wrong answers."
1,1,Pilot,Morty,"Wow. Well, okay, Jessica. L-let's give this a shot."
1,1,Pilot,Jessica,"Mm. Oh, Morty. What are you doing to me?"
1,1,Pilot,Morty,"Uh, I-I'm just doing my best."
1,1,Pilot,Mr. Goldenfold,Morty! What are you doing to me?!
1,1,Pilot,Morty,"Ah, Jessica."
1,1,Pilot,Mr. Goldenfold,Morty!
1,1,Pilot,Morty,Jessica.
1,1,Pilot,Mr. Goldenfold,"Five more minutes of this, and I'm gonna get mad."
1,1,Pilot,Morty,Je-Jessica. Jessica.
1,1,Pilot,Mr. Goldenfold,Not my fault this is happening.
1,1,Pilot,Morty,"Uh, morning, Frank."
1,1,Pilot,Morty,"Oh, geez, Frank. I don't know if a knife is necessary. I mean, you know, y-you kind of had things handled without it."
1,1,Pilot,Rick,"There you are, Morty. Listen to me. I got an errand to run in a whole different dimension. I need an extra pair of hands."
1,1,Pilot,Morty,"Oh, geez, Rick. W-w-what'd you do to Frank?"
1,1,Pilot,Rick,"It's pretty obvious, Morty. I froze him. Now listen I need your help, Morty. I mean, we got we got to get get the hell out of here and go take care of business.  It's important. Come on, Morty."
1,1,Pilot,Morty,"I don't know, Rick. I can't leave school again."
1,1,Pilot,Rick,"Do you have any concept of how much higher the stakes get out there, Morty? What do you think I can just do it all by myself? Come on!"
1,1,Pilot,Morty,"Aw, geez. Okay. I guess I can skip history. What about Frank? I mean, shouldn't you unfreeze him?"
1,1,Pilot,Rick,"I'll do it later, Morty. He'll be fine. Let's go."
1,1,Pilot,Summer,"Hi, Frank."
1,1,Pilot,Summer,AAAAAAAAAAAHHHHH!!!!!!!
1,1,Pilot,Beth,Scalpel.
1,1,Pilot,Jerry,"Knock, knock."
1,1,Pilot,Beth,Jerry?
1,1,Pilot,Jerry,"My manager gave me an hour for lunch, and I thought, ""hey, why not swing by where your wife works?"""
1,1,Pilot,Beth,"Jerry, please tell me you're here for an incredibly urgent reason."
1,1,Pilot,Jerry,"Well, it's lunch. I mean, it's one of three meals that have existed for millennia."
1,1,Pilot,Beth,"Okay, I only ask, Jerry, because, as you know, my job involves performing heart surgery."
1,1,Pilot,Jerry,"Well, yeah, on horses."
1,1,Pilot,Beth,Excuse me?
1,1,Pilot,Jerry,"Okay, Let's not rehash that fight. I sense that you're busy and will now be on my way."
1,1,Pilot,Jerry,"Whoa! What is this on the floor? Some kind of literature for a really nice-looking nursing home. Hey, honey, crazy idea bad pitch let's put your dad here. Let's put your dad in a nursing home."
1,1,Pilot,Beth,"Hey, Tom! We know when we're losing him. WE CAN HEAR THE BEEPS!"
1,1,Pilot,Rick,"There she is. All right. Come on, Morty. Let's go."
1,1,Pilot,Morty,"Oh, geez, okay."
1,1,Pilot,Morty,"Oh, man, Rick. What is this place?"
1,1,Pilot,Rick,"It's Dimension 35-C, and it's got the perfect climate conditions for a special type of tree, Morty, called a Mega Tree, and there's fruit in those trees, and there's seeds in those fruits. I'm talking about Mega Seeds. They're they're incredibly powerful, and I need them to help me with my research, Morty."
1,1,Pilot,Morty,"Oh, man, Rick. I'm looking around this place, and I'm starting to work up some anxiety about this whole thing."
1,1,Pilot,Rick,"All right, all right, calm down. Listen to me, Morty. I know that new situations can be intimidating. You're looking around, and it's all scary and different, but, you know, m-meeting them head on, charging right into them like a bull that's how we grow as people. I'm no stranger to scary situations. I deal with them all the time. Now, if you just stick with me, Morty, we're gonna be—"
1,1,Pilot,Rick,"HOLY CRAP, MORTY RUN!!!"
1,1,Pilot,Rick,"I never seen that thing before in my life. I don't even know what the hell it is! We got to get out of here, Morty! It's gonna kill us! We're gonna die! We're gonna die, Morty!"
1,1,Pilot,Rick,"Oh, Morty, take a deep breath. Breathe that breathe that fresh air in, Morty. Y-you smell that? That's the smell of adventure, Morty. That's that's the smell of-of-of-of a whole different evolutionary timeline."
1,1,Pilot,Morty,"All right, Rick, look how much longer is this gonna be? Shouldn't I be back at school by now?"
1,1,Pilot,Rick,"Are you joking me? I mean, look at all the crazy crap surrounding us. Look at that thing right there.  What the hell is that thing? You think you're gonna see that kind of thing at school?  Look at it just lumbering around.  It defies all logic, that thing."
1,1,Pilot,Morty,"Yeah, Rick, I get it. We're surrounded by monsters. That's kind of the reason why I want to leave."
1,1,Pilot,Rick,"Ta-ta-ta-ta-ta-ta. Morty, you see this?"
1,1,Pilot,Rick,"You see what we just stumbled upon, Morty? Any idea what that is down there?"
1,1,Pilot,Morty,The mega trees?
1,1,Pilot,Rick,"That's right, Morty the mega trees with the mega fruit on them and that's what I'm talking about, Morty. That's where my seeds are. If we would have done what you wanted, I would have never have found them, because you're so in love with school."
1,1,Pilot,Morty,"All right, all right. So, what's so special about these seeds, anyways?"
1,1,Pilot,Rick,"You ask a lot of questions, Morty. Not very charismatic. It makes you kind of an  under-  underfoot figure."
1,1,Pilot,Rick,"Just take these shoes, Morty. They're  special grappling shoes. When you're wearing these things, these babies, you can basically just walk on any surface you want, Morty up, down, below, turn around to the left. These things really bring it all together."
1,1,Pilot,Morty,AAAAAAAHHHH!!!!!!
1,1,Pilot,Rick,"You have to turn them on, Morty! The shoes have to be turned on!"
1,1,Pilot,Beth,"I am not putting my father in a home! He just came back into my life, and you want to grab him and stuff him under a mattress like last month's Victoria's Secret?"
1,1,Pilot,Jerry,"I told you I was ordering you something for Valentine's Day. More importantly, your father is a horrible influence on our son."
1,1,Pilot,Beth,"It's fine, Davin."
1,1,Pilot,Jerry,"Since we're fighting, if you ever have an affair with that guy, I will come to the hotel room and blow my brains out all over your naked bodies."
1,1,Pilot,Beth,"Look, I appreciate the stress you're under, but Morty was having trouble in school way before my dad moved in, and the only influence I can see Rick having is that, for the first time in his life, Morty has a friend."
1,1,Pilot,Jerry,"Well, maybe you're right."
1,1,Pilot,Beth,"Uh, yeah, maybe I am. I'm my father's daughter. I'm smart. Why do you think I'm a heart surgeon?"
1,1,Pilot,Jerry,"Ahem, Horse heart surgeon."
1,1,Pilot,Principal Vagina,"Hello? Mrs. Smith? This is Principal Vagina, no relation. I wonder if you and Morty's father might be able to have a chat with me this afternoon?"
1,1,Pilot,Rick,"Morty, oh, you really d-did a number on  your legs right now. You know, you got to turn  the shoes on, Morty, for them to work. Yeah, look I turned mine on. I had no problem getting down here. It was a leisurely breeze."
1,1,Pilot,Morty,"I'm in a lot of pain, Rick!"
1,1,Pilot,Rick,"Yeah, I can see that. But do you think you'll still be able to help me collect my seeds, Morty?"
1,1,Pilot,Morty,"Are you kidding me?! That's it, Rick! That's the last straw! I can't believe this! I'm sitting here with both of my legs broken, and you're still asking me about getting those seeds?! Ooh! Ow! Oh! Y-y-you're a monster. Y-you're like Hitler, but-but even Hitler cared about Germany or something."
1,1,Pilot,Rick,"Okay, hold on just a second, Morty."
1,1,Pilot,Morty,Ooh! Ohh! Ooh! Hnngh! Hoo! Ooh! Ohh! Aaaaagh! Oooooh!
1,1,Pilot,Morty,"Ooh, Ohh, Ooh. Wow, Rick. That stuff just healed my broken legs instantly. I mean, I've never felt so good in my life. Thank you."
1,1,Pilot,Rick,"Don't worry about it, Morty. Just come help me get these seeds, all right, buddy?"
1,1,Pilot,Morty,"Sure thing, Rick."
1,1,Pilot,Rick,"Not that you asked, Morty, but what just happened there is I went into a future dimension with such advanced medicine that they had broken-leg serum at every corner drugstore.  The stuff was all over the place, Morty."
1,1,Pilot,Morty,"Wow, that's pretty crazy, Rick."
1,1,Pilot,Rick,"There's just one problem, Morty one little hang-up. The dimension I visited was so advanced, that  they had also halted the aging process, and everyone there was young, Morty, and they had been forever. I was the only old person there, Morty.  It was like I was some sort of, you know, celebrity, walking around. I-I was fascinating to them. There were a lot of attractive women there, Morty, and they-they-they— they all wanted time with me. I had a lot of fun with a lot of young ladies, but I spent so much time there, my interdimensional portal device it's got no charge left, Morty. It's got no charge left."
1,1,Pilot,Morty,What?!
1,1,Pilot,Rick,"It's as good as garbage, Morty. It's not gonna work anymore, Morty."
1,1,Pilot,Morty,"Oh, geez, Rick, that's not good. W-what are we gonna do? I-I have to be back at school right now. How are we gonna get back home?"
1,1,Pilot,Rick,"There's ways to get back home, Morty. It's just it's just gonna be a little bit of a hassle. We're gonna have to go through interdimensional customs, so you're gonna have to do me a real solid."
1,1,Pilot,Morty,Uh-oh.
1,1,Pilot,Rick,"When we get to customs, I'm gonna need you to take these seeds into the bathroom, and I'm gonna need you to put them way up inside your butthole, Morty."
1,1,Pilot,Morty,In my butt?
1,1,Pilot,Rick,"Put them way up inside there, as far as they can fit."
1,1,Pilot,Morty,"Oh, geez, Rick. I really don't want to have to do that."
1,1,Pilot,Rick,"Well, somebody's got to do it, Morty. Th-these seeds aren't gonna get through customs unless they're in someone's rectum, Morty"
1,1,Pilot,Morty,Uuuh.
1,1,Pilot,Rick,"And they'll fall right out of mine. I've done this too many times, Morty. I mean, you're young. Y-y-you've got your whole life ahead of you, and your anal cavity is still taut, yet malleable. You got to do it for grandpa, Morty. Y-  you've got to put these seeds inside your butt."
1,1,Pilot,Morty,In my butt?
1,1,Pilot,Rick,"Come on, Morty. Please, Morty. You have to do it, Morty."
1,1,Pilot,Morty,"Oh, man."
1,1,Pilot,Principal Vagina,"The fact is, your son, Morty, has attended this school for a total of seven hours over the last two months."
1,1,Pilot,Beth,What? Why didn't you notify us?
1,1,Pilot,Principal Vagina,I done been notifying you. Have you not been getting the messages I've been leaving with Morty's grandfather?
1,1,Pilot,Jerry,"Boom! Told you! In your face! He is ruining our child! Wait, what am I celebrating?"
1,1,Pilot,Principal Vagina,"Yeah, see, I thought something was fishy there, because it's usually Morty's grandpa that's taking him out of school."
1,1,Pilot,Beth,Summer?
1,1,Pilot,Summer,What kind of God lets this happen?
1,1,Pilot,Principal Vagina,We had a little incident. A student was frozen to death.  And there's no evidence that a Latino student did it! Everyone wants to take this to a racial place. I won't let them.
1,1,Pilot,Announcer,The glarp zone is for flarping and unglarping only.
1,1,Pilot,Announcer,The glarp zone is for flarping and unglarping only.
1,1,Pilot,Rick,"I don't like it here, Morty. I can't abide bureaucracy. I don't like being told where to go and what to do. I consider it a violation. Did you get those seeds all the way up your butt?"
1,1,Pilot,Morty,"Yeah, Rick. Let's just get this over with, okay? I mean, these things are pointy. They hurt."
1,1,Pilot,Rick,"That means they're good ones. You're a good kid, Morty. Those mega seeds are super valuable to my work. You've been a huge help to me. I'm gonna be able to do a-"
1,1,Pilot,Rick,Why does he have to go over there?
1,1,Pilot,Rick,What new-  what new machine?
1,1,Pilot,Rick,"Run, Morty! Run!"
1,1,Pilot,Morty,Aaaaaah!
1,1,Pilot,Morty,Ohhhhh!
1,1,Pilot,Morty,Ohhhhhh!
1,1,Pilot,Morty,Aaaaah!
1,1,Pilot,Rick,Don't think about it!
1,1,Pilot,Rick,"Ooh! Oh, nice, Morty! The student becomes the teacher."
1,1,Pilot,Morty,Whoooooo!
1,1,Pilot,Rick,"I need to type in the coordinates to our home world, Morty. Cover me."
1,1,Pilot,Morty,"Oh, man. I mean, you know, I-I don't want to shoot nobody."
1,1,Pilot,Rick,"They're just robots, Morty! It's okay to shoot them! They're robots!"
1,1,Pilot,Morty,"They're not robots, Rick!"
1,1,Pilot,Rick,"It's a figure of speech, Morty. They're bureaucrats. I don't respect them. Just keep shooting, Morty. You have no idea what prison is like here!"
1,1,Pilot,Morty,Holy crap! This is insane!
1,1,Pilot,Rick,"Come on, Morty! We got to get the hell out of here!"
1,1,Pilot,Jessica,Wow. Did you just come into the cafeteria through a portal?
1,1,Pilot,Morty,"Uh, yeah. Well, you know, my-my Ferrari's in the shop.  Just kidding."
1,1,Pilot,Jessica,"You're Morty, right?"
1,1,Pilot,Morty,Yeah.
1,1,Pilot,Rick,"You can get his number later. Come on, Morty. We got to get out of here. You got to get those seeds out of your ass."
1,1,Pilot,Jerry,"Oh, look, honey. It's our son with Albert Ein-douche."
1,1,Pilot,Beth,What?
1,1,Pilot,Jerry,"I'm an angry father, not an improviser."
1,1,Pilot,Rick,"Oh, hi, Jerry. Oh, my goodness, Morty! What are you doing out of class? We talked about this. Your-your parents and I are very disappointed in-in this behavior... No? No takers?"
1,1,Pilot,Rick,You guys should really not be touching that stuff. It's beyond your reasoning.
1,1,Pilot,Jerry,You're beyond our reasoning!
1,1,Pilot,Rick,Takes one to know one.
1,1,Pilot,Beth,"Dad, how could you make my son miss an entire semester of school? I mean, it's not like he's a hot girl. He can't just bail on his life and set up shop in someone else's."
1,1,Pilot,Rick,What what are you guys doing with my stuff?
1,1,Pilot,Beth,We're moving you to a nursing home.
1,1,Pilot,Rick,"A nursing home? What are what are you, nuts? I'm a genius. I build robots for fun."
1,1,Pilot,Jerry,"Well, now you can build baskets and watch Paul Newman movies on VHS and mentally scar the Boy Scouts every Christmas."
1,1,Pilot,Beth,What does that mean?
1,1,Pilot,Jerry,It's personal.
1,1,Pilot,Morty,"Dad, mom, come on. Rick just needed my help is all."
1,1,Pilot,Jerry,"Morty, stay out of this. You are obviously not capable of judging these situations on your own."
1,1,Pilot,Rick,What are you trying to say about Morty? That he's stupid or something?
1,1,Pilot,Beth,"Oh, don't high-road us, dad. You know fully well that Morty is the last child that needs to be missing classes."
1,1,Pilot,Rick,I-I-I don't know what you mean by that. Can can can you be a little bit more specific?
1,1,Pilot,Jerry,"Oh, for crying out—he's got some kind of disability or something. Is that what you want us to say?"
1,1,Pilot,Morty,I do?
1,1,Pilot,Jerry,"Well, duh doy, son. Look, I love you, Morty, but we both know you're not as fast as the other kids, and if you want to compete in this world, you got to work twice as hard."
1,1,Pilot,Morty,"Aw, geez, dad. Y-you know, that's a lot to drop on a kid all at once."
1,1,Pilot,Rick,"Morty, t-tell your parents the square root of pi."
1,1,Pilot,Morty,"Oh, come on, Rick. You know I can't."
1,1,Pilot,Rick,"The square root of Pi, Morty. Go!"
1,1,Pilot,Morty,1.77245385... Whoa!
1,1,Pilot,Beth,What the hell?
1,1,Pilot,Jerry,Holy crap. He's right.
1,1,Pilot,Rick,"Morty, tell your parents the first law of Thermodynamics."
1,1,Pilot,Morty,"""The increment in the internal energy of a system is equal to the increment of heat supplied to the system."" Wow! I'm so smart!"
1,1,Pilot,Jerry,But—
1,1,Pilot,Rick,I told the both of you school is stupid. It's not how you learn things. Morty's a gifted child. He has a special mind. That's why he's my little helper. He's like me. He's gonna be doing great science stuff later in his life. He's too smart for school. He needs to keep hanging out and helping me.
1,1,Pilot,Beth,"Jerry, I don't want whatever's happening here to stop."
1,1,Pilot,Jerry,"No, I-I understand. Uh, maybe we overreacted. But he has to keep going to school."
1,1,Pilot,Rick,"Okay, Jerry. You drive a hard bargain, but what am I supposed to do? Say no? You-you really wear the pants around here. I just want you to know, between us, from now on, it's gonna be clear communication."
1,1,Pilot,Summer,Frank Palicky was frozen to death today!
1,1,Pilot,Rick,No idea what you're talking about.
1,1,Pilot,Jerry,"Okay. Well, uh, Morty, it's your bedtime in an hour. Don't stay up all night again. This is good, though. This can work. I think we can be a family and now, Beth, if you'll have me, I would love to have you."
1,1,Pilot,Beth,You know what? Okay.
1,1,Pilot,Morty,"Holy cow, Rick. I didn't know hanging out with you was making me smarter."
1,1,Pilot,Rick,"Full disclosure, Morty it's not. Temporary superintelligence is just a side effect of the mega seeds dissolving in your rectal cavity."
1,1,Pilot,Morty,"Aw, man."
1,1,Pilot,Rick,"Yeah, and once those seeds wear off, you're gonna lose most of your motor skills, and you're also gonna lose a significant amount of brain functionality for 72 hours, Morty."
1,1,Pilot,Morty,"Ohh, man.  Oh, geez! Ohh."
1,1,Pilot,Rick,"I'm sorry, Morty. It's a bummer. In reality, you're as dumb as they come and I needed those seeds real bad, and I had to give them up just to get your parents off my back, so now we're gonna have to go get more adventures.  And then we're gonna go on even more adventures after that, Morty and you're gonna keep your mouth shut about it, Morty, because the world is full of idiots that don't understand what's important, and they'll tear us apart, Morty but if you stick with me, I'm gonna accomplish great things, Morty, and you're gonna be part of them, and together, we're gonna run around, Morty. We're gonna do all kinds of wonderful things, Morty. Just you and me, Morty. The outside world is our enemy, Morty. We're the only friends we've got, Morty. It's just Rick and Morty. Rick and Morty and their adventures, Morty. Rick and Morty forever and forever. Morty's things. Me and Rick and Morty running around, and Rick and Morty time. All day long, forever. All a hundred days. Rick and Morty forever 100 times. Over and over, rickandmortyadventures.com. All 100 years. Every minute, rickandmorty.com."
1,2,Lawnmower Dog,Jerry,What? Why are you looking at me? You want to go outside? Outside?
1,2,Lawnmower Dog,Jerry,Outside?
1,2,Lawnmower Dog,Jerry,Are you kidding me?! Come on!
1,2,Lawnmower Dog,Summer,"Oh, my God."
1,2,Lawnmower Dog,Morty,What's wrong?
1,2,Lawnmower Dog,Jerry,Your idiot dog!
1,2,Lawnmower Dog,Morty,"Oh, he he didn't mean it, dad. Did you, snuffles? You're a good boy."
1,2,Lawnmower Dog,Jerry,"Don't praise him now, Morty! He just peed on the carpet! Bad dog! Bad!"
1,2,Lawnmower Dog,Rick,"Morty, come on. I need your help tonight."
1,2,Lawnmower Dog,Jerry,"Hey, wait, hold on a second, Rick. You wouldn't by any chance have some sort of crazy science thing you could whip up that might help make this dog a little smarter, would you?"
1,2,Lawnmower Dog,Rick,"I thought the whole point of having a dog was to feel superior, Jerry. If I were you, I wouldn't pull that thread. Come on, Morty."
1,2,Lawnmower Dog,Jerry,"Listen, Rick, if you're gonna stay here rent-free and use my son for your stupid science, the least you could do is put a little bit of it to use for the family. You make that dog smart or Morty's grounded!"
1,2,Lawnmower Dog,Summer,Ha-ha!
1,2,Lawnmower Dog,Morty,"Aw, man!"
